productType,variantId,sku,prices,tax,categories,images,name.en,description.en,slug.en,metaTitle.en,metaDescription.en,metaKeywords.en,name.de,description.de,slug.de,metaTitle.de,metaDescription.de,metaKeywords.de,name.it,description.it,slug.it,metaTitle.it,metaDescription.it,metaKeywords.it,creationDate,articleNumberManufacturer,articleNumberMax,matrixId,baseId,designer,madeInItaly,completeTheLook,commonSize,size,color,colorFreeDefinition.en,details.en,colorFreeDefinition.de,details.de,colorFreeDefinition.it,details.it,style,gender,season,isOnStock,isLook,lookProducts,seasonNew
main,1,200000037,USD 2290,standard,Shop>Groceries>Fresh,"https://spud-res.cloudinary.com/w_900/f_auto,q_auto,c_fill,h_300,e_improve:30,e_sharpen:60/spudca/Products/-717914005_green_kale.jpg","Organic Kale, Green","Organic green kale is a form of cabbage that is loaded with nutritional value. Filled with manganese, fibre, calcium, and Vitamins K, A, and C, kale has been thought to be one of the most nutritious veggies out there. Try steaming it (rather than eating it raw) to release all of its natural goodness. Have your organic green kale delivered straight to your home for a quick way to prepare a nutritious meal. Take a look at our delivery page for more information about organic produce delivery times and routes along Vancouver Island.",organic-kale-green-200000037,,,,"Organic Kale, Green","Organic green kale is a form of cabbage that is loaded with nutritional value. Filled with manganese, fibre, calcium, and Vitamins K, A, and C, kale has been thought to be one of the most nutritious veggies out there. Try steaming it (rather than eating it raw) to release all of its natural goodness. Have your organic green kale delivered straight to your home for a quick way to prepare a nutritious meal. Take a look at our delivery page for more information about organic produce delivery times and routes along Vancouver Island.",organic-kale-green-200000037,,,,"Organic Kale, Green","Organic green kale is a form of cabbage that is loaded with nutritional value. Filled with manganese, fibre, calcium, and Vitamins K, A, and C, kale has been thought to be one of the most nutritious veggies out there. Try steaming it (rather than eating it raw) to release all of its natural goodness. Have your organic green kale delivered straight to your home for a quick way to prepare a nutritious meal. Take a look at our delivery page for more information about organic produce delivery times and routes along Vancouver Island.",organic-kale-green-200000037,,,,,,,,37,,,,,,,,,,,,,,,,,,,
main,1,200000038,USD 6990,standard,Shop>Groceries>Fresh,"https://spud-res.cloudinary.com/w_900/f_auto,q_auto,c_fill,h_300,e_improve:30,e_sharpen:60/spudca/Products/100914101_kiwis.jpg","Organic Kiwis, Local - Van is/ CA","Fresh, sweet and tangy, kiwi's are packed with Vitamin C. The easiest way to eat a kiwifruit is to simply cut it in half, and scoop out the flesh with a spoon. Tip: The kiwi is also a natural meat tenderizer and cooks have used it in savoury and sweet recipes. Cut a kiwi in half or mash the flesh, rub it over meat, and leave to stand for at least 15-30 minutes.",organic-kiwis-local-van-is-ca-200000038,,,,"Organic Kiwis, Local - Van is/ CA","Fresh, sweet and tangy, kiwi's are packed with Vitamin C. The easiest way to eat a kiwifruit is to simply cut it in half, and scoop out the flesh with a spoon. Tip: The kiwi is also a natural meat tenderizer and cooks have used it in savoury and sweet recipes. Cut a kiwi in half or mash the flesh, rub it over meat, and leave to stand for at least 15-30 minutes.",organic-kiwis-local-van-is-ca-200000038,,,,"Organic Kiwis, Local - Van is/ CA","Fresh, sweet and tangy, kiwi's are packed with Vitamin C. The easiest way to eat a kiwifruit is to simply cut it in half, and scoop out the flesh with a spoon. Tip: The kiwi is also a natural meat tenderizer and cooks have used it in savoury and sweet recipes. Cut a kiwi in half or mash the flesh, rub it over meat, and leave to stand for at least 15-30 minutes.",organic-kiwis-local-van-is-ca-200000038,,,,,,,,38,,,,,,,,,,,,,,,,,,,
main,1,200000039,USD 4990,standard,Shop>Groceries>Fresh,"https://spud-res.cloudinary.com/w_900/f_auto,q_auto,c_fill,h_300,e_improve:30,e_sharpen:60/spudca/Products/-100914303_leeks.jpg",Organic Leek,"Similar to both garlic and onions, our locally grown organic leeks have a mild, subtle flavour and fragrance. With their deep-green, flat, leafy tops and crunchy white stalks, leeks are similar to giant scallions in appearance. They can be enjoyed in a homemade soup or scattered atop a warm omellette. Have your organic leeks delivered straight to your door, making your life simple and healthy. Got any questions about SPUD.ca’s organic grocery deliveries? Our delivery page is filled with answers!",organic-leek-200000039,,,,Organic Leek,"Similar to both garlic and onions, our locally grown organic leeks have a mild, subtle flavour and fragrance. With their deep-green, flat, leafy tops and crunchy white stalks, leeks are similar to giant scallions in appearance. They can be enjoyed in a homemade soup or scattered atop a warm omellette. Have your organic leeks delivered straight to your door, making your life simple and healthy. Got any questions about SPUD.ca’s organic grocery deliveries? Our delivery page is filled with answers!",organic-leek-200000039,,,,Organic Leek,"Similar to both garlic and onions, our locally grown organic leeks have a mild, subtle flavour and fragrance. With their deep-green, flat, leafy tops and crunchy white stalks, leeks are similar to giant scallions in appearance. They can be enjoyed in a homemade soup or scattered atop a warm omellette. Have your organic leeks delivered straight to your door, making your life simple and healthy. Got any questions about SPUD.ca’s organic grocery deliveries? Our delivery page is filled with answers!",organic-leek-200000039,,,,,,,,39,,,,,,,,,,,,,,,,,,,
main,1,200000040,USD 1990,standard,Shop>Groceries>Fresh,"https://spud-res.cloudinary.com/w_900/f_auto,q_auto,c_fill,h_300,e_improve:30,e_sharpen:60/spudca/Products/100914431_lemons.jpg",Organic Lemons,"Add flavour to your meals with fresh organic lemons. The citrus taste and clean juicy texture gives your food that extra punch. Adding fresh lemon to cooked vegetables not only enhances the flavour, but it also increases iron absorption in your body. Have your organic lemons delivered straight to your home for simple healthy living. For more information about organic produce delivery, have a look at our delivery page.",organic-lemons-200000040,,,,Organic Lemons,"Add flavour to your meals with fresh organic lemons. The citrus taste and clean juicy texture gives your food that extra punch. Adding fresh lemon to cooked vegetables not only enhances the flavour, but it also increases iron absorption in your body. Have your organic lemons delivered straight to your home for simple healthy living. For more information about organic produce delivery, have a look at our delivery page.",organic-lemons-200000040,,,,Organic Lemons,"Add flavour to your meals with fresh organic lemons. The citrus taste and clean juicy texture gives your food that extra punch. Adding fresh lemon to cooked vegetables not only enhances the flavour, but it also increases iron absorption in your body. Have your organic lemons delivered straight to your home for simple healthy living. For more information about organic produce delivery, have a look at our delivery page.",organic-lemons-200000040,,,,,,,,40,,,,,,,,,,,,,,,,,,,
main,1,200000041,USD 6990,standard,Shop>Groceries>Fresh,"https://spud-res.cloudinary.com/w_900/f_auto,q_auto,c_fill,h_300,e_improve:30,e_sharpen:60/spudca/Products/205914431.jpg","Organic Lemons, Bagged","Adding fresh lemon to cooked vegetables enhances flavor and increases iron absorbtion. Lemons should be stored in the fridge, but brought out to sit at room temperature before using to increase juice content.",organic-lemons-bagged-200000041,,,,"Organic Lemons, Bagged","Adding fresh lemon to cooked vegetables enhances flavor and increases iron absorbtion. Lemons should be stored in the fridge, but brought out to sit at room temperature before using to increase juice content.",organic-lemons-bagged-200000041,,,,"Organic Lemons, Bagged","Adding fresh lemon to cooked vegetables enhances flavor and increases iron absorbtion. Lemons should be stored in the fridge, but brought out to sit at room temperature before using to increase juice content.",organic-lemons-bagged-200000041,,,,,,,,41,,,,,,,,,,,,,,,,,,,
main,1,200000042,USD 4990,standard,Shop>Groceries>Fresh,"https://spud-res.cloudinary.com/w_900/f_auto,q_auto,c_fill,h_300,e_improve:30,e_sharpen:60/spudca/Products/-213914555_green_leaf_lettuce.jpg","Organic Lettuce, Leaf",Any of several varieties of lettuce with leaves that branch from a single stalk in a loose bunch rather than forming a tight head.,organic-lettuce-leaf-200000042,,,,"Organic Lettuce, Leaf",Any of several varieties of lettuce with leaves that branch from a single stalk in a loose bunch rather than forming a tight head.,organic-lettuce-leaf-200000042,,,,"Organic Lettuce, Leaf",Any of several varieties of lettuce with leaves that branch from a single stalk in a loose bunch rather than forming a tight head.,organic-lettuce-leaf-200000042,,,,,,,,42,,,,,,,,,,,,,,,,,,,
main,1,200000043,USD 3490,standard,Shop>Groceries>Fresh,"https://spud-res.cloudinary.com/w_900/f_auto,q_auto,c_fill,h_300,e_improve:30,e_sharpen:60/spudca/Products/-120914555_Lettuce_romaine.jpg","Organic Lettuce, Romaine","Make your meal heart-healthy with organic romaine lettuce. The crisp, crunchy leaves are filled with beta-carotene and Vitamins K, A, and C… all great for giving your heart a smile. Here at Spud.ca, our produce team promises that your organic romaine lettuce arrives succulent and fresh upon delivery. If it’s not perfect, we’ll refund you, no questions asked",organic-lettuce-romaine-200000043,,,,"Organic Lettuce, Romaine","Make your meal heart-healthy with organic romaine lettuce. The crisp, crunchy leaves are filled with beta-carotene and Vitamins K, A, and C… all great for giving your heart a smile. Here at Spud.ca, our produce team promises that your organic romaine lettuce arrives succulent and fresh upon delivery. If it’s not perfect, we’ll refund you, no questions asked",organic-lettuce-romaine-200000043,,,,"Organic Lettuce, Romaine","Make your meal heart-healthy with organic romaine lettuce. The crisp, crunchy leaves are filled with beta-carotene and Vitamins K, A, and C… all great for giving your heart a smile. Here at Spud.ca, our produce team promises that your organic romaine lettuce arrives succulent and fresh upon delivery. If it’s not perfect, we’ll refund you, no questions asked",organic-lettuce-romaine-200000043,,,,,,,,43,,,,,,,,,,,,,,,,,,,
main,1,200000044,USD 1990,standard,Shop>Groceries>Fresh,"https://spud-res.cloudinary.com/w_900/f_auto,q_auto,c_fill,h_300,e_improve:30,e_sharpen:60/spudca/Products/100914631_limes.jpg",Organic Limes,"Add flavour to your meals with fresh organic limes. The citrus taste and clean juicy texture gives your food that extra punch. Adding fresh lime to cooked vegetables not only enhances the flavour, but it also increases iron absorption in your body. Have your organic limes delivered straight to your home for simple, delicious, healthy living",organic-limes-200000044,,,,Organic Limes,"Add flavour to your meals with fresh organic limes. The citrus taste and clean juicy texture gives your food that extra punch. Adding fresh lime to cooked vegetables not only enhances the flavour, but it also increases iron absorption in your body. Have your organic limes delivered straight to your home for simple, delicious, healthy living",organic-limes-200000044,,,,Organic Limes,"Add flavour to your meals with fresh organic limes. The citrus taste and clean juicy texture gives your food that extra punch. Adding fresh lime to cooked vegetables not only enhances the flavour, but it also increases iron absorption in your body. Have your organic limes delivered straight to your home for simple, delicious, healthy living",organic-limes-200000044,,,,,,,,44,,,,,,,,,,,,,,,,,,,
main,1,200000045,USD 2000,standard,Shop>Groceries>Fresh,https://www.spud.ca/pictures/ProductPhotos/placeholder-s.png,"Organic Mangos, Case - Tommy Atkin",A case of Mangos.,organic-mangos-case-tommy-atkin-200000045,,,,"Organic Mangos, Case - Tommy Atkin",A case of Mangos.,organic-mangos-case-tommy-atkin-200000045,,,,"Organic Mangos, Case - Tommy Atkin",A case of Mangos.,organic-mangos-case-tommy-atkin-200000045,,,,,,,,45,,,,,,,,,,,,,,,,,,,
main,1,200000046,USD 3990,standard,Shop>Groceries>Fresh,"https://spud-res.cloudinary.com/w_900/f_auto,q_auto,c_fill,h_300,e_improve:30,e_sharpen:60/spudca/Products/144914921_Tommy_Atkins.jpg","Organic Mangos, Tommy Atkins","It's no wonder the Tommy Atkins mango is one of the most popular. The meat has the sweetness of a peach, the colour of an apricot and just enough fibre to give it some chewiness. Have these juicy organic mangos delivered straight to your home, or have them sent to the office for some fresh healthy snacking everywhere you go! ",organic-mangos-tommy-atkins-200000046,,,,"Organic Mangos, Tommy Atkins","It's no wonder the Tommy Atkins mango is one of the most popular. The meat has the sweetness of a peach, the colour of an apricot and just enough fibre to give it some chewiness. Have these juicy organic mangos delivered straight to your home, or have them sent to the office for some fresh healthy snacking everywhere you go! ",organic-mangos-tommy-atkins-200000046,,,,"Organic Mangos, Tommy Atkins","It's no wonder the Tommy Atkins mango is one of the most popular. The meat has the sweetness of a peach, the colour of an apricot and just enough fibre to give it some chewiness. Have these juicy organic mangos delivered straight to your home, or have them sent to the office for some fresh healthy snacking everywhere you go! ",organic-mangos-tommy-atkins-200000046,,,,,,,,46,,,,,,,,,,,,,,,,,,,
main,1,200000047,USD 9990,standard,Shop>Groceries>Fresh,"https://spud-res.cloudinary.com/w_900/f_auto,q_auto,c_fill,h_300,e_improve:30,e_sharpen:60/spudca/Products/-345915312_Oyster__mushroom.jpg","Local Organic Mushrooms, Oyster - BC Grown",Oyster mushrooms are a delicately flavoured fan shaped mushroom that grows on wood substrate.,local-organic-mushrooms-oyster-bc-grown-200000047,,,,"Local Organic Mushrooms, Oyster - BC Grown",Oyster mushrooms are a delicately flavoured fan shaped mushroom that grows on wood substrate.,local-organic-mushrooms-oyster-bc-grown-200000047,,,,"Local Organic Mushrooms, Oyster - BC Grown",Oyster mushrooms are a delicately flavoured fan shaped mushroom that grows on wood substrate.,local-organic-mushrooms-oyster-bc-grown-200000047,,,,,,,,47,,,,,,,,,,,,,,,,,,,
main,1,200000048,USD 4990,standard,Shop>Groceries>Fresh,"https://spud-res.cloudinary.com/w_900/f_auto,q_auto,c_fill,h_300,e_improve:30,e_sharpen:60/spudca/Products/-623915312_portabella_mushroom.jpg","Local Organic Mushrooms, Portabella - BC Grown","The massive portabella mushroom has an easily identifiable round, tan-to-brown flat cap that is securely attached to a thick edible stem. This mushroom is one of the largest available. Because the portabella has a longer growing cycle, it becomes this impressive mushroom that boasts a very substantial and meaty texture.",local-organic-mushrooms-portabella-bc-grown-200000048,,,,"Local Organic Mushrooms, Portabella - BC Grown","The massive portabella mushroom has an easily identifiable round, tan-to-brown flat cap that is securely attached to a thick edible stem. This mushroom is one of the largest available. Because the portabella has a longer growing cycle, it becomes this impressive mushroom that boasts a very substantial and meaty texture.",local-organic-mushrooms-portabella-bc-grown-200000048,,,,"Local Organic Mushrooms, Portabella - BC Grown","The massive portabella mushroom has an easily identifiable round, tan-to-brown flat cap that is securely attached to a thick edible stem. This mushroom is one of the largest available. Because the portabella has a longer growing cycle, it becomes this impressive mushroom that boasts a very substantial and meaty texture.",local-organic-mushrooms-portabella-bc-grown-200000048,,,,,,,,48,,,,,,,,,,,,,,,,,,,
main,1,200000049,USD 4990,standard,Shop>Groceries>Fresh,"https://spud-res.cloudinary.com/w_900/f_auto,q_auto,c_fill,h_300,e_improve:30,e_sharpen:60/spudca/Products/-127915312_Shitake_mushroom.jpg","Local Organic Mushrooms, Shiitake - BC Grown","Shiitake is the second most widely cultivated mushroom in the world and highly prized for its flavor and health-promoting properties. 'Shii' is Japanese for oak and 'take' means mushroom. Shiitakes provide high levels of protein (18% by mass), potassium, niacin and B vitamins, calcium, magnesium and phosphorus. The mushroom has all essential amino acids. Shiitakes have natural antiviral and immunity-boosting properties and are used nutritionally to fight viruses, lower cholesterol and regulate blood pressure.",local-organic-mushrooms-shiitake-bc-grown-200000049,,,,"Local Organic Mushrooms, Shiitake - BC Grown","Shiitake is the second most widely cultivated mushroom in the world and highly prized for its flavor and health-promoting properties. 'Shii' is Japanese for oak and 'take' means mushroom. Shiitakes provide high levels of protein (18% by mass), potassium, niacin and B vitamins, calcium, magnesium and phosphorus. The mushroom has all essential amino acids. Shiitakes have natural antiviral and immunity-boosting properties and are used nutritionally to fight viruses, lower cholesterol and regulate blood pressure.",local-organic-mushrooms-shiitake-bc-grown-200000049,,,,"Local Organic Mushrooms, Shiitake - BC Grown","Shiitake is the second most widely cultivated mushroom in the world and highly prized for its flavor and health-promoting properties. 'Shii' is Japanese for oak and 'take' means mushroom. Shiitakes provide high levels of protein (18% by mass), potassium, niacin and B vitamins, calcium, magnesium and phosphorus. The mushroom has all essential amino acids. Shiitakes have natural antiviral and immunity-boosting properties and are used nutritionally to fight viruses, lower cholesterol and regulate blood pressure.",local-organic-mushrooms-shiitake-bc-grown-200000049,,,,,,,,49,,,,,,,,,,,,,,,,,,,
main,1,200000050,USD 3290,standard,Shop>Groceries>Fresh,"https://spud-res.cloudinary.com/w_900/f_auto,q_auto,c_fill,h_300,e_improve:30,e_sharpen:60/spudca/Products/-149915312_White_mushroom_2.jpg","Local Organic Mushrooms, White - BC Grown","Not only are numerous health advantages offered by these little wonders (including anti-cancer benefits, antioxidant benefits, and immune system support), but organic White mushrooms taste great too. They have a mild, woodsy flavour that intensifies with cooking. Our produce team here at Spud.ca ensures that your organic White mushrooms arrive fresh upon delivery. If it’s not perfect, we’ll refund you, no questions asked. Have any questions about our organic produce delivery services? Take a look at our delivery page for routes and times across Vancouver Island.",local-organic-mushrooms-white-bc-grown-200000050,,,,"Local Organic Mushrooms, White - BC Grown","Not only are numerous health advantages offered by these little wonders (including anti-cancer benefits, antioxidant benefits, and immune system support), but organic White mushrooms taste great too. They have a mild, woodsy flavour that intensifies with cooking. Our produce team here at Spud.ca ensures that your organic White mushrooms arrive fresh upon delivery. If it’s not perfect, we’ll refund you, no questions asked. Have any questions about our organic produce delivery services? Take a look at our delivery page for routes and times across Vancouver Island.",local-organic-mushrooms-white-bc-grown-200000050,,,,"Local Organic Mushrooms, White - BC Grown","Not only are numerous health advantages offered by these little wonders (including anti-cancer benefits, antioxidant benefits, and immune system support), but organic White mushrooms taste great too. They have a mild, woodsy flavour that intensifies with cooking. Our produce team here at Spud.ca ensures that your organic White mushrooms arrive fresh upon delivery. If it’s not perfect, we’ll refund you, no questions asked. Have any questions about our organic produce delivery services? Take a look at our delivery page for routes and times across Vancouver Island.",local-organic-mushrooms-white-bc-grown-200000050,,,,,,,,50,,,,,,,,,,,,,,,,,,,
main,1,200000051,USD 2290,standard,Shop>Groceries>Fresh,"https://spud-res.cloudinary.com/w_900/f_auto,q_auto,c_fill,h_300,e_improve:30,e_sharpen:60/spudca/Products/-305915603_Green_onions.jpg","Organic Onions, Green","Simply just immature onions, these fresh organic green onions can be used in a variety of culinary dishes. Whether sitting atop a baked potato or scattered throughout an omelette, green onions are the perfect enhancement to any meal. Here at Spud.ca, our produce team promises that your organic green onions arrive fresh and crisp upon delivery. If it’s not perfect, we’ll refund you, no questions asked. Glance at our delivery page for more information about organic grocery delivery times and routes across Vancouver Island.",organic-onions-green-200000051,,,,"Organic Onions, Green","Simply just immature onions, these fresh organic green onions can be used in a variety of culinary dishes. Whether sitting atop a baked potato or scattered throughout an omelette, green onions are the perfect enhancement to any meal. Here at Spud.ca, our produce team promises that your organic green onions arrive fresh and crisp upon delivery. If it’s not perfect, we’ll refund you, no questions asked. Glance at our delivery page for more information about organic grocery delivery times and routes across Vancouver Island.",organic-onions-green-200000051,,,,"Organic Onions, Green","Simply just immature onions, these fresh organic green onions can be used in a variety of culinary dishes. Whether sitting atop a baked potato or scattered throughout an omelette, green onions are the perfect enhancement to any meal. Here at Spud.ca, our produce team promises that your organic green onions arrive fresh and crisp upon delivery. If it’s not perfect, we’ll refund you, no questions asked. Glance at our delivery page for more information about organic grocery delivery times and routes across Vancouver Island.",organic-onions-green-200000051,,,,,,,,51,,,,,,,,,,,,,,,,,,,
main,1,200000052,USD 2990,standard,Shop>Groceries>Fresh,"https://spud-res.cloudinary.com/w_900/f_auto,q_auto,c_fill,h_300,e_improve:30,e_sharpen:60/spudca/Products/-841815603_onions_red_1_5LB.jpg","Organic Onions, Red","Onions have been cultivated for over 6000 years. Store onions in a cool, dry well ventilated area. Cut onions may be covered and stored in the fridge for 2 - 3 days. Cut onions under cold water to wash away the sulfer that causes teary eyes.",organic-onions-red-200000052,,,,"Organic Onions, Red","Onions have been cultivated for over 6000 years. Store onions in a cool, dry well ventilated area. Cut onions may be covered and stored in the fridge for 2 - 3 days. Cut onions under cold water to wash away the sulfer that causes teary eyes.",organic-onions-red-200000052,,,,"Organic Onions, Red","Onions have been cultivated for over 6000 years. Store onions in a cool, dry well ventilated area. Cut onions may be covered and stored in the fridge for 2 - 3 days. Cut onions under cold water to wash away the sulfer that causes teary eyes.",organic-onions-red-200000052,,,,,,,,52,,,,,,,,,,,,,,,,,,,
main,1,200000053,USD 2490,standard,Shop>Groceries>Fresh,"https://spud-res.cloudinary.com/w_900/f_auto,q_auto,c_fill,h_300,e_improve:30,e_sharpen:60/spudca/Products/-152215603_Onions_Yellow_v2.jpg","Organic Onions, Yellow","Known as the all-purpose onion, these organic yellow onions have discovered the perfect balance between sweet and pungent. Not only are these gems of the earth ideal for cooking, they are loaded with fiber and protein! Here at Spud.ca, our produce team promises that your organic yellow onions arrive Earthy and fresh upon delivery. If it’s not perfect, we’ll refund you, no questions asked. Check out our delivery page for more information about organic produce delivery times and routes across Vancouver Island.",organic-onions-yellow-200000053,,,,"Organic Onions, Yellow","Known as the all-purpose onion, these organic yellow onions have discovered the perfect balance between sweet and pungent. Not only are these gems of the earth ideal for cooking, they are loaded with fiber and protein! Here at Spud.ca, our produce team promises that your organic yellow onions arrive Earthy and fresh upon delivery. If it’s not perfect, we’ll refund you, no questions asked. Check out our delivery page for more information about organic produce delivery times and routes across Vancouver Island.",organic-onions-yellow-200000053,,,,"Organic Onions, Yellow","Known as the all-purpose onion, these organic yellow onions have discovered the perfect balance between sweet and pungent. Not only are these gems of the earth ideal for cooking, they are loaded with fiber and protein! Here at Spud.ca, our produce team promises that your organic yellow onions arrive Earthy and fresh upon delivery. If it’s not perfect, we’ll refund you, no questions asked. Check out our delivery page for more information about organic produce delivery times and routes across Vancouver Island.",organic-onions-yellow-200000053,,,,,,,,53,,,,,,,,,,,,,,,,,,,
