productType,variantId,sku,prices,tax,categories,images,name.en,description.en,slug.en,metaTitle.en,metaDescription.en,metaKeywords.en,name.de,description.de,slug.de,metaTitle.de,metaDescription.de,metaKeywords.de,name.it,description.it,slug.it,metaTitle.it,metaDescription.it,metaKeywords.it,creationDate,articleNumberManufacturer,articleNumberMax,matrixId,baseId,designer,madeInItaly,completeTheLook,commonSize,size,color,colorFreeDefinition.en,details.en,colorFreeDefinition.de,details.de,colorFreeDefinition.it,details.it,style,gender,season,isOnStock,isLook,lookProducts,seasonNew
main,1,200000019,USD 5990,standard,Shop>Groceries>Fresh,"https://spud-res.cloudinary.com/w_900/f_auto,q_auto,c_fill,h_300,e_improve:30,e_sharpen:60/spudca/Products/-100911402_broccoli.jpg","Organic Broccoli, Bunch","Broccoli, a member of the mustard family, contains high levels of lutein and sulphorphane which encourage the production of cancer fighting enzymes in the body. Store broccoli in the crisper or upright with the stalk in a container of water.",organic-broccoli-bunch-200000019,,,,"Organic Broccoli, Bunch","Broccoli, a member of the mustard family, contains high levels of lutein and sulphorphane which encourage the production of cancer fighting enzymes in the body. Store broccoli in the crisper or upright with the stalk in a container of water.",organic-broccoli-bunch-200000019,,,,"Organic Broccoli, Bunch","Broccoli, a member of the mustard family, contains high levels of lutein and sulphorphane which encourage the production of cancer fighting enzymes in the body. Store broccoli in the crisper or upright with the stalk in a container of water.",organic-broccoli-bunch-200000019,,,,,,,,19,,,,,,,,,,,Black,multi,,multi,,,,,
main,1,200000020,USD 3990,standard,Shop>Groceries>Fresh,"https://spud-res.cloudinary.com/w_900/f_auto,q_auto,c_fill,h_300,e_improve:30,e_sharpen:60/spudca/Products/-100911502_Brussels_Sprouts_v2.jpg",Organic Brussels Sprouts,"Named after the capital of Belgium, where they may have first been cultivated. They look like small heads of cabbage; in fact they belong to the cabbage family. A cruciferous vegetable, thought to protect against certain forms of cancer.",organic-brussels-sprouts-200000020,,,,Organic Brussels Sprouts,"Named after the capital of Belgium, where they may have first been cultivated. They look like small heads of cabbage; in fact they belong to the cabbage family. A cruciferous vegetable, thought to protect against certain forms of cancer.",organic-brussels-sprouts-200000020,,,,Organic Brussels Sprouts,"Named after the capital of Belgium, where they may have first been cultivated. They look like small heads of cabbage; in fact they belong to the cabbage family. A cruciferous vegetable, thought to protect against certain forms of cancer.",organic-brussels-sprouts-200000020,,,,,,,,20,,,,,,,,,,,Black,multi,,multi,,,,,
main,1,200000021,USD 6990,standard,Shop>Groceries>Fresh,"https://spud-res.cloudinary.com/w_900/f_auto,q_auto,c_fill,h_300,e_improve:30,e_sharpen:60/spudca/Products/-305911602_Green_Cabbage.jpg","Local Organic Cabbage, Green","Cabbage is high in anti-carcinogenic phytochemicals, so it stimulates the immune system’s production of antibodies. Simply saying, cabbage is great for your body, heart and mind. Order our fresh organic cabbage along with your other produce necessities, and have them delivered right to your doorstep. Our grocery delivery services are sure to serve your needs!",local-organic-cabbage-green-200000021,,,,"Local Organic Cabbage, Green","Cabbage is high in anti-carcinogenic phytochemicals, so it stimulates the immune system’s production of antibodies. Simply saying, cabbage is great for your body, heart and mind. Order our fresh organic cabbage along with your other produce necessities, and have them delivered right to your doorstep. Our grocery delivery services are sure to serve your needs!",local-organic-cabbage-green-200000021,,,,"Local Organic Cabbage, Green","Cabbage is high in anti-carcinogenic phytochemicals, so it stimulates the immune system’s production of antibodies. Simply saying, cabbage is great for your body, heart and mind. Order our fresh organic cabbage along with your other produce necessities, and have them delivered right to your doorstep. Our grocery delivery services are sure to serve your needs!",local-organic-cabbage-green-200000021,,,,,,,,21,,,,,,,,,,,Black,multi,,multi,,,,,
main,1,200000022,USD 6990,standard,Shop>Groceries>Fresh,"https://spud-res.cloudinary.com/w_900/f_auto,q_auto,c_fill,h_300,e_improve:30,e_sharpen:60/spudca/Products/275915004_cantaloupe.jpg",Organic Cantaloupe,"Being the most widely used and enjoyed melons in the United States, organic cantaloupes are loaded with beta-carotene, Vitamin C, and Vitamin A. Enjoy this heart-healthy fruit served fresh and chilled for a nutritious snack. We take pride in providing you with the sustainable produce that your body deserves. Here at Spud.ca, our hardworking produce team ensures that you receive your organic cantaloupes as fresh as can be.",organic-cantaloupe-200000022,,,,Organic Cantaloupe,"Being the most widely used and enjoyed melons in the United States, organic cantaloupes are loaded with beta-carotene, Vitamin C, and Vitamin A. Enjoy this heart-healthy fruit served fresh and chilled for a nutritious snack. We take pride in providing you with the sustainable produce that your body deserves. Here at Spud.ca, our hardworking produce team ensures that you receive your organic cantaloupes as fresh as can be.",organic-cantaloupe-200000022,,,,Organic Cantaloupe,"Being the most widely used and enjoyed melons in the United States, organic cantaloupes are loaded with beta-carotene, Vitamin C, and Vitamin A. Enjoy this heart-healthy fruit served fresh and chilled for a nutritious snack. We take pride in providing you with the sustainable produce that your body deserves. Here at Spud.ca, our hardworking produce team ensures that you receive your organic cantaloupes as fresh as can be.",organic-cantaloupe-200000022,,,,,,,,22,,,,,,,,,,,Black,multi,,multi,,,,,
main,1,200000023,USD 5490,standard,Shop>Groceries>Fresh,"https://spud-res.cloudinary.com/w_900/f_auto,q_auto,c_fill,h_300,e_improve:30,e_sharpen:60/spudca/Products/-271911703_Carrots_Bunched.jpg","Organic Carrots, Bunched","Being one of the most widely used and enjoyed produce items in the world, organic carrots are loaded with beta-carotene, Vitamin C, and Vitamin A. Your heart has already cracked a smile. Here at Spud.ca, we take pride in serving you with the organic, sustainable produce that you deserve. And that’s why our produce team ensures that you receive your organic carrots as though they came straight from the farm: fresh and delicious. Have a look at our delivery page for more information on organic produce delivery times and routes on Vancouver Island.",organic-carrots-bunched-200000023,,,,"Organic Carrots, Bunched","Being one of the most widely used and enjoyed produce items in the world, organic carrots are loaded with beta-carotene, Vitamin C, and Vitamin A. Your heart has already cracked a smile. Here at Spud.ca, we take pride in serving you with the organic, sustainable produce that you deserve. And that’s why our produce team ensures that you receive your organic carrots as though they came straight from the farm: fresh and delicious. Have a look at our delivery page for more information on organic produce delivery times and routes on Vancouver Island.",organic-carrots-bunched-200000023,,,,"Organic Carrots, Bunched","Being one of the most widely used and enjoyed produce items in the world, organic carrots are loaded with beta-carotene, Vitamin C, and Vitamin A. Your heart has already cracked a smile. Here at Spud.ca, we take pride in serving you with the organic, sustainable produce that you deserve. And that’s why our produce team ensures that you receive your organic carrots as though they came straight from the farm: fresh and delicious. Have a look at our delivery page for more information on organic produce delivery times and routes on Vancouver Island.",organic-carrots-bunched-200000023,,,,,,,,23,,,,,,,,,,,Black,multi,,multi,,,,,
main,1,200000024,USD 6990,standard,Shop>Groceries>Fresh,"https://spud-res.cloudinary.com/w_900/f_auto,q_auto,c_fill,h_300,e_improve:30,e_sharpen:60/spudca/Products/-100911802_Cauliflower.jpg",Organic Cauliflower,Cauliflower is similar to broccoli in both nutritional value and appearance: they are both members of the cancer-preventing cruciferous group of veggies. Try sautéing your organic cauliflower (rather then conventional methods of steaming or boiling) to maintain its crisp texture and fresh flavour. Have your organic cauliflower delivered straight to your door to make your life simple and healthy. Check out our delivery page for more information about Spud.ca’s online grocery delivery services.,organic-cauliflower-200000024,,,,Organic Cauliflower,Cauliflower is similar to broccoli in both nutritional value and appearance: they are both members of the cancer-preventing cruciferous group of veggies. Try sautéing your organic cauliflower (rather then conventional methods of steaming or boiling) to maintain its crisp texture and fresh flavour. Have your organic cauliflower delivered straight to your door to make your life simple and healthy. Check out our delivery page for more information about Spud.ca’s online grocery delivery services.,organic-cauliflower-200000024,,,,Organic Cauliflower,Cauliflower is similar to broccoli in both nutritional value and appearance: they are both members of the cancer-preventing cruciferous group of veggies. Try sautéing your organic cauliflower (rather then conventional methods of steaming or boiling) to maintain its crisp texture and fresh flavour. Have your organic cauliflower delivered straight to your door to make your life simple and healthy. Check out our delivery page for more information about Spud.ca’s online grocery delivery services.,organic-cauliflower-200000024,,,,,,,,24,,,,,,,,,,,Black,multi,,multi,,,,,
main,1,200000025,USD 4490,standard,Shop>Groceries>Fresh,"https://spud-res.cloudinary.com/w_900/f_auto,q_auto,c_fill,h_300,e_improve:30,e_sharpen:60/spudca/Products/-105912002_Chard_Rainbow.jpg","Organic Chard, Swiss","Chard is the green part of a certain variety of beet. Remove the leaf from the stock and add to stir fries, stews or steam and eat on its own with a squeeze of lemon. Chard is high in vitamins C and A and magnesium, iron and potassium.",organic-chard-swiss-200000025,,,,"Organic Chard, Swiss","Chard is the green part of a certain variety of beet. Remove the leaf from the stock and add to stir fries, stews or steam and eat on its own with a squeeze of lemon. Chard is high in vitamins C and A and magnesium, iron and potassium.",organic-chard-swiss-200000025,,,,"Organic Chard, Swiss","Chard is the green part of a certain variety of beet. Remove the leaf from the stock and add to stir fries, stews or steam and eat on its own with a squeeze of lemon. Chard is high in vitamins C and A and magnesium, iron and potassium.",organic-chard-swiss-200000025,,,,,,,,25,,,,,,,,,,,Black,multi,,multi,,,,,
main,1,200000026,USD 2490,standard,Shop>Groceries>Fresh,"https://spud-res.cloudinary.com/w_900/f_auto,q_auto,c_fill,h_300,e_improve:30,e_sharpen:60/spudca/Products/-100912245_Cilantro.jpg",Organic Cilantro,"Looking for a mild, peppery addition to your meal? Try our locally grown, organic cilantro. With its pungent sage-citrus essence, cilantro is a delicious additive to any dish. It “lifts” the taste of the other portions of the meal, and provides a fresh, earthy, clean zest that perks up your taste buds. Often used in Mexican, Indian and Chinese cooking, try using it in your cooking with grilled organic free-range chicken breast. You won’t be disappointed. Our sustainable food delivery services are a great alternative after a hard day at work. Have your organic cilantro delivered to your door today!",organic-cilantro-200000026,,,,Organic Cilantro,"Looking for a mild, peppery addition to your meal? Try our locally grown, organic cilantro. With its pungent sage-citrus essence, cilantro is a delicious additive to any dish. It “lifts” the taste of the other portions of the meal, and provides a fresh, earthy, clean zest that perks up your taste buds. Often used in Mexican, Indian and Chinese cooking, try using it in your cooking with grilled organic free-range chicken breast. You won’t be disappointed. Our sustainable food delivery services are a great alternative after a hard day at work. Have your organic cilantro delivered to your door today!",organic-cilantro-200000026,,,,Organic Cilantro,"Looking for a mild, peppery addition to your meal? Try our locally grown, organic cilantro. With its pungent sage-citrus essence, cilantro is a delicious additive to any dish. It “lifts” the taste of the other portions of the meal, and provides a fresh, earthy, clean zest that perks up your taste buds. Often used in Mexican, Indian and Chinese cooking, try using it in your cooking with grilled organic free-range chicken breast. You won’t be disappointed. Our sustainable food delivery services are a great alternative after a hard day at work. Have your organic cilantro delivered to your door today!",organic-cilantro-200000026,,,,,,,,26,,,,,,,,,,,Black,multi,,multi,,,,,
main,1,200000027,USD 44990,standard,Shop>Groceries>Fresh,"https://spud-res.cloudinary.com/w_900/f_auto,q_auto,c_fill,h_300,e_improve:30,e_sharpen:60/spudca/Products/-1120912604_Cucumbers_Long_English_CASE_new.jpg","Organic Cucumbers, Case","Due to their high water content and subtle flavor cucumbers are usually eaten raw. When cutting a cucumber start at the pointed flower end to prevent a bitter taste. Cut or uncut, cucumbers should always be stored in plastic bags in the fridge.",organic-cucumbers-case-200000027,,,,"Organic Cucumbers, Case","Due to their high water content and subtle flavor cucumbers are usually eaten raw. When cutting a cucumber start at the pointed flower end to prevent a bitter taste. Cut or uncut, cucumbers should always be stored in plastic bags in the fridge.",organic-cucumbers-case-200000027,,,,"Organic Cucumbers, Case","Due to their high water content and subtle flavor cucumbers are usually eaten raw. When cutting a cucumber start at the pointed flower end to prevent a bitter taste. Cut or uncut, cucumbers should always be stored in plastic bags in the fridge.",organic-cucumbers-case-200000027,,,,,,,,27,,,,,,,,,,,Black,multi,,multi,,,,,
main,1,200000028,USD 3990,standard,Shop>Groceries>Fresh,"https://spud-res.cloudinary.com/w_900/f_auto,q_auto,c_fill,h_300,e_improve:30,e_sharpen:60/spudca/Products/-332912604_long_english_cucumber.jpg","Organic Cucumbers, Long English","Organic Long English cucumbers are necessary for a healthy, balanced diet because of their high Vitamin C, water, and fiber contents. Cucumbers also contain numerous compounds, such as silica, that keep skin looking radiant and youthful. Here at Spud.ca, our produce team ensures that our organic Long English cucumbers arrive at your door as if they were taken straight from the farm.",organic-cucumbers-long-english-200000028,,,,"Organic Cucumbers, Long English","Organic Long English cucumbers are necessary for a healthy, balanced diet because of their high Vitamin C, water, and fiber contents. Cucumbers also contain numerous compounds, such as silica, that keep skin looking radiant and youthful. Here at Spud.ca, our produce team ensures that our organic Long English cucumbers arrive at your door as if they were taken straight from the farm.",organic-cucumbers-long-english-200000028,,,,"Organic Cucumbers, Long English","Organic Long English cucumbers are necessary for a healthy, balanced diet because of their high Vitamin C, water, and fiber contents. Cucumbers also contain numerous compounds, such as silica, that keep skin looking radiant and youthful. Here at Spud.ca, our produce team ensures that our organic Long English cucumbers arrive at your door as if they were taken straight from the farm.",organic-cucumbers-long-english-200000028,,,,,,,,28,,,,,,,,,,,Black,multi,,multi,,,,,
main,1,200000029,USD 2990,standard,Shop>Groceries>Fresh,"https://spud-res.cloudinary.com/w_900/f_auto,q_auto,c_fill,h_300,e_improve:30,e_sharpen:60/spudca/Products/-100913442_Garlic.jpg","Organic Garlic, White",Garlic contains allin which has natural antibiotic and bactericidal effects. Garlic can be mild or hot,organic-garlic-white-200000029,,,,"Organic Garlic, White",Garlic contains allin which has natural antibiotic and bactericidal effects. Garlic can be mild or hot,organic-garlic-white-200000029,,,,"Organic Garlic, White",Garlic contains allin which has natural antibiotic and bactericidal effects. Garlic can be mild or hot,organic-garlic-white-200000029,,,,,,,,29,,,,,,,,,,,Black,multi,,multi,,,,,
main,1,200000030,USD 1990,standard,Shop>Groceries>Fresh,"https://spud-res.cloudinary.com/w_900/f_auto,q_auto,c_fill,h_300,e_improve:30,e_sharpen:60/spudca/Products/-100913543_ginger.jpg",Organic Ginger,"This tropical tuber is a fabulous addition to stir fry, curry or grated into herbal tea. Store ginger dry in the fridge, or tightly wraped in the freezer it will last for up to 3 months.",organic-ginger-200000030,,,,Organic Ginger,"This tropical tuber is a fabulous addition to stir fry, curry or grated into herbal tea. Store ginger dry in the fridge, or tightly wraped in the freezer it will last for up to 3 months.",organic-ginger-200000030,,,,Organic Ginger,"This tropical tuber is a fabulous addition to stir fry, curry or grated into herbal tea. Store ginger dry in the fridge, or tightly wraped in the freezer it will last for up to 3 months.",organic-ginger-200000030,,,,,,,,30,,,,,,,,,,,,,,,,,,,
main,1,200000031,USD 2290,standard,Shop>Groceries>Fresh,"https://spud-res.cloudinary.com/w_900/f_auto,q_auto,c_fill,h_300,e_improve:30,e_sharpen:60/spudca/Products/100913731_grapefruit.jpg",Organic Grapefruit,The pectin contained in this subtropical evergreen has been shown to help lower LDL (bad) cholesterol. Store grapefruit at room temperature for up to a week and for prolonged storage keep grapefruit in the fridge.,organic-grapefruit-200000031,,,,Organic Grapefruit,The pectin contained in this subtropical evergreen has been shown to help lower LDL (bad) cholesterol. Store grapefruit at room temperature for up to a week and for prolonged storage keep grapefruit in the fridge.,organic-grapefruit-200000031,,,,Organic Grapefruit,The pectin contained in this subtropical evergreen has been shown to help lower LDL (bad) cholesterol. Store grapefruit at room temperature for up to a week and for prolonged storage keep grapefruit in the fridge.,organic-grapefruit-200000031,,,,,,,,31,,,,,,,,,,,,,,,,,,,
main,1,200000032,USD 3290,standard,Shop>Groceries>Fresh,"https://spud-res.cloudinary.com/w_900/f_auto,q_auto,c_fill,h_300,e_improve:30,e_sharpen:60/spudca/Products/-757913945_Dill.jpg","Local Organic Herbs, Baby Dill","28gr clamshell Dill weed is used to flavor many dishes such as salads, vegetables, meats and sauces. Fresh dill loses its fragrance during heating, so should be added toward the end of the cooking time.",local-organic-herbs-baby-dill-200000032,,,,"Local Organic Herbs, Baby Dill","28gr clamshell Dill weed is used to flavor many dishes such as salads, vegetables, meats and sauces. Fresh dill loses its fragrance during heating, so should be added toward the end of the cooking time.",local-organic-herbs-baby-dill-200000032,,,,"Local Organic Herbs, Baby Dill","28gr clamshell Dill weed is used to flavor many dishes such as salads, vegetables, meats and sauces. Fresh dill loses its fragrance during heating, so should be added toward the end of the cooking time.",local-organic-herbs-baby-dill-200000032,,,,,,,,32,,,,,,,,,,,,,,,,,,,
main,1,200000033,USD 3290,standard,Shop>Groceries>Fresh,"https://spud-res.cloudinary.com/w_900/f_auto,q_auto,c_fill,h_300,e_improve:30,e_sharpen:60/spudca/Products/-100910845_Basil_v2.jpg","Organic Herbs, Basil","Enjoy the fresh fragrant taste of organic basil! With the emerald-green, round leaves, basil is often reminiscent of peppermint. However it has a strong, pungent, sweet and earthy smell that is much different than peppermint. Have it delivered straight to your door for simple healthy living along with your other organic produce deliveries.",organic-herbs-basil-200000033,,,,"Organic Herbs, Basil","Enjoy the fresh fragrant taste of organic basil! With the emerald-green, round leaves, basil is often reminiscent of peppermint. However it has a strong, pungent, sweet and earthy smell that is much different than peppermint. Have it delivered straight to your door for simple healthy living along with your other organic produce deliveries.",organic-herbs-basil-200000033,,,,"Organic Herbs, Basil","Enjoy the fresh fragrant taste of organic basil! With the emerald-green, round leaves, basil is often reminiscent of peppermint. However it has a strong, pungent, sweet and earthy smell that is much different than peppermint. Have it delivered straight to your door for simple healthy living along with your other organic produce deliveries.",organic-herbs-basil-200000033,,,,,,,,33,,,,,,,,,,,,,,,,,,,
main,1,200000034,USD 3290,standard,Shop>Groceries>Fresh,"https://spud-res.cloudinary.com/w_900/f_auto,q_auto,c_fill,h_300,e_improve:30,e_sharpen:60/spudca/Products/-753913945_Herb_Mint.jpg","Local Organic Herbs, Mint","There are over 30 species of mint, the two most popular and widely available being peppermint and spearmint. Peppermint has bright green leaves, purple-tinged stems and a peppery flavor. Spearmint leaves are gray-green or true green and have a milder flavor and fragrance. Mint can be used as a tea, added to boiled potatoes, your fruit or veggy salad, fresh juices, or favourite recipes.",local-organic-herbs-mint-200000034,,,,"Local Organic Herbs, Mint","There are over 30 species of mint, the two most popular and widely available being peppermint and spearmint. Peppermint has bright green leaves, purple-tinged stems and a peppery flavor. Spearmint leaves are gray-green or true green and have a milder flavor and fragrance. Mint can be used as a tea, added to boiled potatoes, your fruit or veggy salad, fresh juices, or favourite recipes.",local-organic-herbs-mint-200000034,,,,"Local Organic Herbs, Mint","There are over 30 species of mint, the two most popular and widely available being peppermint and spearmint. Peppermint has bright green leaves, purple-tinged stems and a peppery flavor. Spearmint leaves are gray-green or true green and have a milder flavor and fragrance. Mint can be used as a tea, added to boiled potatoes, your fruit or veggy salad, fresh juices, or favourite recipes.",local-organic-herbs-mint-200000034,,,,,,,,34,,,,,,,,,,,,,,,,,,,
main,1,200000035,USD 3290,standard,Shop>Groceries>Fresh,"https://spud-res.cloudinary.com/w_900/f_auto,q_auto,c_fill,h_300,e_improve:30,e_sharpen:60/spudca/Products/-100917445_Rosemary.jpg","Organic Herbs, Rosemary",Rosemary has highly aromatic needle-shaped leaves with a flavour that hints of both lemon and pine.,organic-herbs-rosemary-200000035,,,,"Organic Herbs, Rosemary",Rosemary has highly aromatic needle-shaped leaves with a flavour that hints of both lemon and pine.,organic-herbs-rosemary-200000035,,,,"Organic Herbs, Rosemary",Rosemary has highly aromatic needle-shaped leaves with a flavour that hints of both lemon and pine.,organic-herbs-rosemary-200000035,,,,,,,,35,,,,,,,,,,,,,,,,,,,
main,1,200000036,USD 3290,standard,Shop>Groceries>Fresh,"https://spud-res.cloudinary.com/w_900/f_auto,q_auto,c_fill,h_300,e_improve:30,e_sharpen:60/spudca/Products/-818913945_Herb_thyme.jpg","Local Organic Herbs, Thyme","Thyme has a delightful lemon aroma and can be sweet to pungent. Fresh thyme has the most flavor and can be used whole as the stem will lend flavor to a sauce after simmering. Thyme is native to European countries with warm climates, but is grown in nearly every country of the world",local-organic-herbs-thyme-200000036,,,,"Local Organic Herbs, Thyme","Thyme has a delightful lemon aroma and can be sweet to pungent. Fresh thyme has the most flavor and can be used whole as the stem will lend flavor to a sauce after simmering. Thyme is native to European countries with warm climates, but is grown in nearly every country of the world",local-organic-herbs-thyme-200000036,,,,"Local Organic Herbs, Thyme","Thyme has a delightful lemon aroma and can be sweet to pungent. Fresh thyme has the most flavor and can be used whole as the stem will lend flavor to a sauce after simmering. Thyme is native to European countries with warm climates, but is grown in nearly every country of the world",local-organic-herbs-thyme-200000036,,,,,,,,36,,,,,,,,,,,,,,,,,,,
