productType,variantId,sku,prices,tax,categories,images,name.en,description.en,slug.en,metaTitle.en,metaDescription.en,metaKeywords.en,name.de,description.de,slug.de,metaTitle.de,metaDescription.de,metaKeywords.de,name.it,description.it,slug.it,metaTitle.it,metaDescription.it,metaKeywords.it,creationDate,articleNumberManufacturer,articleNumberMax,matrixId,baseId,designer,madeInItaly,completeTheLook,commonSize,size,color,colorFreeDefinition.en,details.en,colorFreeDefinition.de,details.de,colorFreeDefinition.it,details.it,style,gender,season,isOnStock,isLook,lookProducts,seasonNew
main,1,200000001, USD 3290,standard,Shop>Groceries>Fresh,"https://spud-res.cloudinary.com/w_900/f_auto,q_auto,c_fill,h_300,e_improve:30,e_sharpen:60/spudca/Products/-282915312_Mushrooms_Crimini_v2.jpg","Local Organic Mushrooms, Crimini - BC Grown","Not only are numerous health advantages offered by these little wonders (including anti-cancer benefits, antioxidant benefits, and immune system support), but organic crimini mushrooms taste great too. Crimini mushrooms are juvenile portabellas (aka portobellos) which have a deeper, denser, earthier flavour than White mushrooms and are the perfect addition to a delicious meal.",local-organic-mushrooms-crimini-bc-grown-200000001,,,,"Local Organic Mushrooms, Crimini - BC Grown","Not only are numerous health advantages offered by these little wonders (including anti-cancer benefits, antioxidant benefits, and immune system support), but organic crimini mushrooms taste great too. Crimini mushrooms are juvenile portabellas (aka portobellos) which have a deeper, denser, earthier flavour than White mushrooms and are the perfect addition to a delicious meal.",local-organic-mushrooms-crimini-bc-grown-200000001,,,,"Local Organic Mushrooms, Crimini - BC Grown","Not only are numerous health advantages offered by these little wonders (including anti-cancer benefits, antioxidant benefits, and immune system support), but organic crimini mushrooms taste great too. Crimini mushrooms are juvenile portabellas (aka portobellos) which have a deeper, denser, earthier flavour than White mushrooms and are the perfect addition to a delicious meal.",local-organic-mushrooms-crimini-bc-grown-200000001,,,,,,,,1,,,,,,,,,,,Black,multi,,multi,,,,,
main,1,200000002,USD 6990,standard,Shop>Groceries>Fresh,"https://spud-res.cloudinary.com/w_900/f_auto,q_auto,c_fill,h_300,e_improve:30,e_sharpen:60/spudca/Products/738921401_Dates_Medjool_8oz.jpg","Organic Date, Medjool, 8 oz","The Medjool Date, once a delicacy know only to royalty, is now the most popular date in the world. Per Serving Size: 2 to 3 dates (40g) dates have: Calories: 140 - Sodium: 10mg - Total Carbohydrates: 36g - Dietary Fiber - 3g - Sugars - 29g - Protein: 1g - Potassium: 200mg - Calcium: 2% & Iron: 2% of Daily Recommended Value",organic-date-medjool-8-oz-200000002,,,,"Organic Date, Medjool, 8 oz","The Medjool Date, once a delicacy know only to royalty, is now the most popular date in the world. Per Serving Size: 2 to 3 dates (40g) dates have: Calories: 140 - Sodium: 10mg - Total Carbohydrates: 36g - Dietary Fiber - 3g - Sugars - 29g - Protein: 1g - Potassium: 200mg - Calcium: 2% & Iron: 2% of Daily Recommended Value",organic-date-medjool-8-oz-200000002,,,,"Organic Date, Medjool, 8 oz","The Medjool Date, once a delicacy know only to royalty, is now the most popular date in the world. Per Serving Size: 2 to 3 dates (40g) dates have: Calories: 140 - Sodium: 10mg - Total Carbohydrates: 36g - Dietary Fiber - 3g - Sugars - 29g - Protein: 1g - Potassium: 200mg - Calcium: 2% & Iron: 2% of Daily Recommended Value",organic-date-medjool-8-oz-200000002,,,,,,,,2,,,,,,,,,,,Black,multi,,multi,,,,,
main,1,200000003,USD 9900,standard,Shop>Groceries>Fresh,"https://spud-res.cloudinary.com/w_900/f_auto,q_auto,c_fill,h_300,e_improve:30,e_sharpen:60/spudca/Products/-419910629_Avocado_Hass_v2.jpg","Organic Avocado, Hass","Creamy, buttery and oh so decadent, avocados are a great addition to any sushi roll, sandwich, salad or Mexican dish. They also provide nearly 20 essential nutrients, including Vitamin E, B-Vitamins, folic acid and essential fats",organic-avocado-hass-200000003,,,,"Organic Avocado, Hass","Creamy, buttery and oh so decadent, avocados are a great addition to any sushi roll, sandwich, salad or Mexican dish. They also provide nearly 20 essential nutrients, including Vitamin E, B-Vitamins, folic acid and essential fats",organic-avocado-hass-200000003,,,,"Organic Avocado, Hass","Creamy, buttery and oh so decadent, avocados are a great addition to any sushi roll, sandwich, salad or Mexican dish. They also provide nearly 20 essential nutrients, including Vitamin E, B-Vitamins, folic acid and essential fats",organic-avocado-hass-200000003,,,,,,,,3,,,,,,,,,,,Black,multi,,multi,,,,,
main,1,200000004,USD 3990,standard,Shop>Groceries>Fresh,"https://spud-res.cloudinary.com/w_900/f_auto,q_auto,c_fill,h_300,e_improve:30,e_sharpen:60/spudca/Products/-100911902_Celery.jpg",Organic Celery,"Celery has a fresh clean taste and its crunch gives a nice texture to salads, soups, stews and casseroles. We enjoy celery served on its own with a creamy dip or peanut butter.",organic-celery-200000004,,,,Organic Celery,"Celery has a fresh clean taste and its crunch gives a nice texture to salads, soups, stews and casseroles. We enjoy celery served on its own with a creamy dip or peanut butter.",organic-celery-200000004,,,,Organic Celery,"Celery has a fresh clean taste and its crunch gives a nice texture to salads, soups, stews and casseroles. We enjoy celery served on its own with a creamy dip or peanut butter.",organic-celery-200000004,,,,,,,,4,,,,,,,,,,,Black,multi,,multi,,,,,
main,1,200000005,USD 2490,standard,Shop>Groceries>Fresh,"https://spud-res.cloudinary.com/w_900/f_auto,q_auto,c_fill,h_300,e_improve:30,e_sharpen:60/spudca/Products/386910101_apples_ambrosia.jpg","Local Organic Apples, Ambrosia","The skin is smooth, with a bright, almost iridescent pink blush over a creamy white background. The flesh is creamy, tender, and juicy, with a very fine, crisp texture. It is a sweet, low-acid apple, with a pleasing aroma",local-organic-apples-ambrosia-200000005,,,,"Local Organic Apples, Ambrosia","The skin is smooth, with a bright, almost iridescent pink blush over a creamy white background. The flesh is creamy, tender, and juicy, with a very fine, crisp texture. It is a sweet, low-acid apple, with a pleasing aroma",local-organic-apples-ambrosia-200000005,,,,"Local Organic Apples, Ambrosia","The skin is smooth, with a bright, almost iridescent pink blush over a creamy white background. The flesh is creamy, tender, and juicy, with a very fine, crisp texture. It is a sweet, low-acid apple, with a pleasing aroma",local-organic-apples-ambrosia-200000005,,,,,,,,5,,,,,,,,,,,Black,multi,,multi,,,,,
main,1,200000006,USD 7990,standard,Shop>Groceries>Fresh,"https://spud-res.cloudinary.com/w_900/f_auto,q_auto,c_fill,h_300,e_improve:30,e_sharpen:60/spudca/Products/859910101_Apples_Bagged_Ambrosia_v2.jpg","Local Organic Apples, Bagged Ambrosia","The skin is smooth, with a bright, almost iridescent pink blush over a creamy white background. The flesh is creamy, tender, and juicy, with a very fine, crisp texture. It is a sweet, low-acid apple, with a pleasing aroma.",local-organic-apples-bagged-ambrosia-200000006,,,,"Local Organic Apples, Bagged Ambrosia","The skin is smooth, with a bright, almost iridescent pink blush over a creamy white background. The flesh is creamy, tender, and juicy, with a very fine, crisp texture. It is a sweet, low-acid apple, with a pleasing aroma.",local-organic-apples-bagged-ambrosia-200000006,,,,"Local Organic Apples, Bagged Ambrosia","The skin is smooth, with a bright, almost iridescent pink blush over a creamy white background. The flesh is creamy, tender, and juicy, with a very fine, crisp texture. It is a sweet, low-acid apple, with a pleasing aroma.",local-organic-apples-bagged-ambrosia-200000006,,,,,,,,6,,,,,,,,,,,Black,multi,,multi,,,,,
main,1,200000007,USD 7990,standard,Shop>Groceries>Fresh,"https://spud-res.cloudinary.com/w_900/f_auto,q_auto,c_fill,h_300,e_improve:30,e_sharpen:60/spudca/Products/786910101_bagged_apples_fuji.jpg","Local Organic Apples, Bagged Fuji","These apples have a base colouring of yellow and green overlaid with red stripes, Fuji apples are juicy and sweet with firm, cream-coloured flesh. Excellent for desserts or eating out-of-hand.",local-organic-apples-bagged-fuji-200000007,,,,"Local Organic Apples, Bagged Fuji","These apples have a base colouring of yellow and green overlaid with red stripes, Fuji apples are juicy and sweet with firm, cream-coloured flesh. Excellent for desserts or eating out-of-hand.",local-organic-apples-bagged-fuji-200000007,,,,"Local Organic Apples, Bagged Fuji","These apples have a base colouring of yellow and green overlaid with red stripes, Fuji apples are juicy and sweet with firm, cream-coloured flesh. Excellent for desserts or eating out-of-hand.",local-organic-apples-bagged-fuji-200000007,,,,,,,,7,,,,,,,,,,,Black,multi,,multi,,,,,
main,1,200000008,USD 7990,standard,Shop>Groceries>Fresh,"https://spud-res.cloudinary.com/w_900/f_auto,q_auto,c_fill,h_300,e_improve:30,e_sharpen:60/spudca/Products/554910101_apples_bagged_gala.jpg","Local Organic Apples, Bagged Gala","The Gala apple blends modern and old-fashioned parentage. It is aromatic with a very sweet flavor and crisp, firm texture. This variety has Cox's Orange Pippin, and both Red and Golden Delicious in its family tree. It ripens early and keeps well.",local-organic-apples-bagged-gala-200000008,,,,"Local Organic Apples, Bagged Gala","The Gala apple blends modern and old-fashioned parentage. It is aromatic with a very sweet flavor and crisp, firm texture. This variety has Cox's Orange Pippin, and both Red and Golden Delicious in its family tree. It ripens early and keeps well.",local-organic-apples-bagged-gala-200000008,,,,"Local Organic Apples, Bagged Gala","The Gala apple blends modern and old-fashioned parentage. It is aromatic with a very sweet flavor and crisp, firm texture. This variety has Cox's Orange Pippin, and both Red and Golden Delicious in its family tree. It ripens early and keeps well.",local-organic-apples-bagged-gala-200000008,,,,,,,,8,,,,,,,,,,,Black,multi,,multi,,,,,
main,1,200000009,USD 24990,standard,Shop>Groceries>Fresh,"https://spud-res.cloudinary.com/w_900/f_auto,q_auto,c_fill,h_300,e_improve:30,e_sharpen:60/spudca/Products/1005910101_BC_Apple_Sampler.jpg","Local Organic Apples, BC Apple Sampler","A selection of 3-4 BC grown apple varieties, this box contains 10lbs of Organic BC Apples. Varieties may include Ambrosia, Gala, Honeycrisp, McIntosh, Fuji and others.",local-organic-apples-bc-apple-sampler-200000009,,,,"Local Organic Apples, BC Apple Sampler","A selection of 3-4 BC grown apple varieties, this box contains 10lbs of Organic BC Apples. Varieties may include Ambrosia, Gala, Honeycrisp, McIntosh, Fuji and others.",local-organic-apples-bc-apple-sampler-200000009,,,,"Local Organic Apples, BC Apple Sampler","A selection of 3-4 BC grown apple varieties, this box contains 10lbs of Organic BC Apples. Varieties may include Ambrosia, Gala, Honeycrisp, McIntosh, Fuji and others.",local-organic-apples-bc-apple-sampler-200000009,,,,,,,,9,,,,,,,,,,,Black,multi,,multi,,,,,
main,1,200000010,USD 2490,standard,Shop>Groceries>Fresh,"https://spud-res.cloudinary.com/w_900/f_auto,q_auto,c_fill,h_300,e_improve:30,e_sharpen:60/spudca/Products/298910101_gala.jpg","Local Organic Apples, Gala","With its mild sweet flavour, crisp texture, and picture-perfect red colour, is it a surprise that the Gala is one of the most popular apples? Our produce team here at Spud.ca ensures that our organic Gala apples arrive to you as though they were picked right off of the tree: fresh and delicious. If it’s not perfect, we’ll refund you, no questions asked. Try our organic Gala apples sautéed in our Kale with Sautéed Apple and Onion recipe. Check out our recipe page for more meal ideas with fresh Gala apples. Organic Gala apples can be delivered to most areas on Vancouver Island. Have a look at our delivery page for times and routes across the island.",local-organic-apples-gala-200000010,,,,"Local Organic Apples, Gala","With its mild sweet flavour, crisp texture, and picture-perfect red colour, is it a surprise that the Gala is one of the most popular apples? Our produce team here at Spud.ca ensures that our organic Gala apples arrive to you as though they were picked right off of the tree: fresh and delicious. If it’s not perfect, we’ll refund you, no questions asked. Try our organic Gala apples sautéed in our Kale with Sautéed Apple and Onion recipe. Check out our recipe page for more meal ideas with fresh Gala apples. Organic Gala apples can be delivered to most areas on Vancouver Island. Have a look at our delivery page for times and routes across the island.",local-organic-apples-gala-200000010,,,,"Local Organic Apples, Gala","With its mild sweet flavour, crisp texture, and picture-perfect red colour, is it a surprise that the Gala is one of the most popular apples? Our produce team here at Spud.ca ensures that our organic Gala apples arrive to you as though they were picked right off of the tree: fresh and delicious. If it’s not perfect, we’ll refund you, no questions asked. Try our organic Gala apples sautéed in our Kale with Sautéed Apple and Onion recipe. Check out our recipe page for more meal ideas with fresh Gala apples. Organic Gala apples can be delivered to most areas on Vancouver Island. Have a look at our delivery page for times and routes across the island.",local-organic-apples-gala-200000010,,,,,,,,10,,,,,,,,,,,Black,multi,,multi,,,,,
main,1,200000011,USD 2490,standard,Shop>Groceries>Fresh,"https://spud-res.cloudinary.com/w_900/f_auto,q_auto,c_fill,h_300,e_improve:30,e_sharpen:60/spudca/Products/304910101_apples_granny_smith.jpg","Local Organic Apples, Granny Smith",The tart and tangy granny smith apples are characterized by their bright green skin. These apples are great for snacking on and also retain flavour and moisture when cooking with them. These apples are usually available late October.,local-organic-apples-granny-smith-200000011,,,,"Local Organic Apples, Granny Smith",The tart and tangy granny smith apples are characterized by their bright green skin. These apples are great for snacking on and also retain flavour and moisture when cooking with them. These apples are usually available late October.,local-organic-apples-granny-smith-200000011,,,,"Local Organic Apples, Granny Smith",The tart and tangy granny smith apples are characterized by their bright green skin. These apples are great for snacking on and also retain flavour and moisture when cooking with them. These apples are usually available late October.,local-organic-apples-granny-smith-200000011,,,,,,,,11,,,,,,,,,,,Black,multi,,multi,,,,,
main,1,200000012,USD 3290,standard,Shop>Groceries>Fresh,"https://spud-res.cloudinary.com/w_900/f_auto,q_auto,c_fill,h_300,e_improve:30,e_sharpen:60/spudca/Products/604910101_apples_Honey_crisp.jpg","Local Organic Apples, Honeycrisp","The Honeycrisp is distinguished by a mottled red-over-yellow skin. The fruit has a crisp, juicy texture, and the flesh is cream coloured and coarse.",local-organic-apples-honeycrisp-200000012,,,,"Local Organic Apples, Honeycrisp","The Honeycrisp is distinguished by a mottled red-over-yellow skin. The fruit has a crisp, juicy texture, and the flesh is cream coloured and coarse.",local-organic-apples-honeycrisp-200000012,,,,"Local Organic Apples, Honeycrisp","The Honeycrisp is distinguished by a mottled red-over-yellow skin. The fruit has a crisp, juicy texture, and the flesh is cream coloured and coarse.",local-organic-apples-honeycrisp-200000012,,,,,,,,12,,,,,,,,,,,Black,multi,,multi,,,,,
main,1,200000013,USD 5990,standard,Shop>Groceries>Fresh,"https://spud-res.cloudinary.com/w_900/f_auto,q_auto,c_fill,h_300,e_improve:30,e_sharpen:60/spudca/Products/-934910455_baby_arugula.jpg","Organic Arugula, Baby Arugula",This product traveled 1569 km to reach our warehouse.,organic-arugula-baby-arugula-200000013,,,,"Organic Arugula, Baby Arugula",This product traveled 1569 km to reach our warehouse.,organic-arugula-baby-arugula-200000013,,,,"Organic Arugula, Baby Arugula",This product traveled 1569 km to reach our warehouse.,organic-arugula-baby-arugula-200000013,,,,,,,,13,,,,,,,,,,,Black,multi,,multi,,,,,
main,1,200000014,USD 3790,standard,Shop>Groceries>Fresh,"https://spud-res.cloudinary.com/w_900/f_auto,q_auto,c_fill,h_300,e_improve:30,e_sharpen:60/spudca/Products/100910721_Bananas_v2.jpg",Organic Bananas,"With their high potassium and low sodium contents, our organic bananas are one of the most popular choices for fresh produce. Bananas are also very high in Vitamin C, manganese and dietary fiber, all essential necessities for a balanced diet. Our produce team here at Spud.ca promises that our organic bananas arrive at your doorstep as if they were picked right off of the tree: tasty and fresh. Try using our organic bananas in our delicious vegan Banana Bread for a fun baking idea. These organic bananas are available for delivery to most areas on Vancouver Island. For more information about organic grocery delivery times and routes, take a look at our delivery page.",organic-bananas-200000014,,,,Organic Bananas,"With their high potassium and low sodium contents, our organic bananas are one of the most popular choices for fresh produce. Bananas are also very high in Vitamin C, manganese and dietary fiber, all essential necessities for a balanced diet. Our produce team here at Spud.ca promises that our organic bananas arrive at your doorstep as if they were picked right off of the tree: tasty and fresh. Try using our organic bananas in our delicious vegan Banana Bread for a fun baking idea. These organic bananas are available for delivery to most areas on Vancouver Island. For more information about organic grocery delivery times and routes, take a look at our delivery page.",organic-bananas-200000014,,,,Organic Bananas,"With their high potassium and low sodium contents, our organic bananas are one of the most popular choices for fresh produce. Bananas are also very high in Vitamin C, manganese and dietary fiber, all essential necessities for a balanced diet. Our produce team here at Spud.ca promises that our organic bananas arrive at your doorstep as if they were picked right off of the tree: tasty and fresh. Try using our organic bananas in our delicious vegan Banana Bread for a fun baking idea. These organic bananas are available for delivery to most areas on Vancouver Island. For more information about organic grocery delivery times and routes, take a look at our delivery page.",organic-bananas-200000014,,,,,,,,14,,,,,,,,,,,Black,multi,,multi,,,,,
main,1,200000015,USD 900,standard,Shop>Groceries>Fresh,"https://spud-res.cloudinary.com/w_900/f_auto,q_auto,c_fill,h_300,e_improve:30,e_sharpen:60/spudca/Products/1050910721_Bananas_Over-Ripe_new.jpg","Organic Bananas, Imperfect","Our over-ripe/imperfect bananas are perfect for baking, making smoothies, milkshakes and even ice-cream. These bananas may have slight bruising, brown dotting and will not be in pretty bunches, but they are just as delicious and nutritious as their perfect counterparts.",organic-bananas-imperfect-200000015,,,,"Organic Bananas, Imperfect","Our over-ripe/imperfect bananas are perfect for baking, making smoothies, milkshakes and even ice-cream. These bananas may have slight bruising, brown dotting and will not be in pretty bunches, but they are just as delicious and nutritious as their perfect counterparts.",organic-bananas-imperfect-200000015,,,,"Organic Bananas, Imperfect","Our over-ripe/imperfect bananas are perfect for baking, making smoothies, milkshakes and even ice-cream. These bananas may have slight bruising, brown dotting and will not be in pretty bunches, but they are just as delicious and nutritious as their perfect counterparts.",organic-bananas-imperfect-200000015,,,,,,,,15,,,,,,,,,,,Black,multi,,multi,,,,,
main,1,200000016,USD 2990,standard,Shop>Groceries>Fresh,"https://spud-res.cloudinary.com/w_900/f_auto,q_auto,c_fill,h_300,e_improve:30,e_sharpen:60/spudca/Products/-205911003_beets_red.jpg","Organic Beets, Red","The sweet red, nutrient rich flesh of the beet contains: iron, phosphorus, sodium, magnesium, calcium and potassium. During pregnancy eating beets can reduce the risk of birth defects by increasing folate intake. Store beets uncovered in the fridge.",organic-beets-red-200000016,,,,"Organic Beets, Red","The sweet red, nutrient rich flesh of the beet contains: iron, phosphorus, sodium, magnesium, calcium and potassium. During pregnancy eating beets can reduce the risk of birth defects by increasing folate intake. Store beets uncovered in the fridge.",organic-beets-red-200000016,,,,"Organic Beets, Red","The sweet red, nutrient rich flesh of the beet contains: iron, phosphorus, sodium, magnesium, calcium and potassium. During pregnancy eating beets can reduce the risk of birth defects by increasing folate intake. Store beets uncovered in the fridge.",organic-beets-red-200000016,,,,,,,,16,,,,,,,,,,,Black,multi,,multi,,,,,
main,1,200000017,USD 4990,standard,Shop>Groceries>Fresh,"https://spud-res.cloudinary.com/w_900/f_auto,q_auto,c_fill,h_300,e_improve:30,e_sharpen:60/spudca/Products/100911206_blueberries.jpg",Organic Blueberries,"Jam-packed with antioxidants, fiber and Vitamin C, blueberries are known to be a ‘superfood’. Enjoy these superheroes from May through October to experience the best-tasting, best-looking, and best-feeling organic blueberries around. Here at Spud.ca, we take pride in providing you with the organic, sustainable produce that you deserve. And that’s why our produce team ensures that you receive your organic blueberries as though they came straight from the farm: fresh and delicious. Check out our delivery page for more information on sustainable food delivery times and routes on Vancouver Island.",organic-blueberries-200000017,,,,Organic Blueberries,"Jam-packed with antioxidants, fiber and Vitamin C, blueberries are known to be a ‘superfood’. Enjoy these superheroes from May through October to experience the best-tasting, best-looking, and best-feeling organic blueberries around. Here at Spud.ca, we take pride in providing you with the organic, sustainable produce that you deserve. And that’s why our produce team ensures that you receive your organic blueberries as though they came straight from the farm: fresh and delicious. Check out our delivery page for more information on sustainable food delivery times and routes on Vancouver Island.",organic-blueberries-200000017,,,,Organic Blueberries,"Jam-packed with antioxidants, fiber and Vitamin C, blueberries are known to be a ‘superfood’. Enjoy these superheroes from May through October to experience the best-tasting, best-looking, and best-feeling organic blueberries around. Here at Spud.ca, we take pride in providing you with the organic, sustainable produce that you deserve. And that’s why our produce team ensures that you receive your organic blueberries as though they came straight from the farm: fresh and delicious. Check out our delivery page for more information on sustainable food delivery times and routes on Vancouver Island.",organic-blueberries-200000017,,,,,,,,17,,,,,,,,,,,Black,multi,,multi,,,,,
main,1,200000018,USD 5990,standard,Shop>Groceries>Fresh,"https://spud-res.cloudinary.com/w_900/f_auto,q_auto,c_fill,h_300,e_improve:30,e_sharpen:60/spudca/Products/-100911302_Bok_Choy.jpg",Organic Bok Choy,"Also called Chinese white cabbage, bok choy is a mild, versatile veggie with crunchy white stalks and tender, dark green leaves. Our organic bok choy, grown locally in BC, is a popular choice in stir-fries or simply served raw in a salad. It has a delicate, sweet flavour and is very high in nutritional value- the perfect new addition to your meals. Have your organic bok choy delivered straight to your door for simple healthy living. Also, if you have any questions about our organic produce deliveries check out our delivery page for answers!",organic-bok-choy-200000018,,,,Organic Bok Choy,"Also called Chinese white cabbage, bok choy is a mild, versatile veggie with crunchy white stalks and tender, dark green leaves. Our organic bok choy, grown locally in BC, is a popular choice in stir-fries or simply served raw in a salad. It has a delicate, sweet flavour and is very high in nutritional value- the perfect new addition to your meals. Have your organic bok choy delivered straight to your door for simple healthy living. Also, if you have any questions about our organic produce deliveries check out our delivery page for answers!",organic-bok-choy-200000018,,,,Organic Bok Choy,"Also called Chinese white cabbage, bok choy is a mild, versatile veggie with crunchy white stalks and tender, dark green leaves. Our organic bok choy, grown locally in BC, is a popular choice in stir-fries or simply served raw in a salad. It has a delicate, sweet flavour and is very high in nutritional value- the perfect new addition to your meals. Have your organic bok choy delivered straight to your door for simple healthy living. Also, if you have any questions about our organic produce deliveries check out our delivery page for answers!",organic-bok-choy-200000018,,,,,,,,18,,,,,,,,,,,Black,multi,,multi,,,,,
